<!ELEMENT empleados (empleado+)>
<!ELEMENT empleado (id, nombre, edad, departamento)>
<!ELEMENT id (#PCDATA)>
<!ELEMENT nombre (#PCDATA)>
<!ELEMENT edad (#PCDATA)>
<!ELEMENT departamento (#PCDATA)>
